<!ELEMENT ListaDeTareas (Tarea+)>
<!ELEMENT Tarea (Titulo, Subtareas)>
<!ELEMENT Titulo (#PCDATA)>
<!ELEMENT Subtareas (Subtarea+)>
<!ELEMENT Subtarea (#PCDATA)>